{
  "schema_version": "1.0",
  "device_id": "demo-pi",
  "session_id": "demo-session",
  "epoch": 1,
  "source_time_us": 500000,
  "model_hash": "sha256:8780dfeca1acfd3a292d90f614b12b25abff4c2e77e83ba7f8926a4d8bf9d445",
  "decision_id": "decision-demo",
  "event_id": "event-demo",
  "batch_seq": 1,
  "encoder_hash": "sha256:cf0a898563e7f8d928454f91faaf5a92dc29d41afd3be7feabf58d267ff0e78c",
  "trigger": true,
  "status": "valid",
  "score": null,
  "score_kind": "unavailable",
  "provenance": "demo"
}
